ID,规则编号,规则名称,文档名称,文档地址,API名称,所属父类,问题位置（行号）,问题状态,严重程度,Kit名称,开发责任人,测试责任人,问题描述,备注,修改建议,问题原文,规则提示词,质量维度,一级指标,二级指标,评估内容（测试点）,是否是问题,原因,修改方案
cmramc1hw0qdkh67bmcwpyvwp,12.1.1.2,检查文档中清楚地说明了使用场景。,capi-arkui-nativemodule-arkui-crosslanguageoption.md,https://gitcode.com/openharmony/docs/blob/master/zh-cn/application-dev/reference/apis-arkui/capi-arkui-nativemodule-arkui-crosslanguageoption.md,,ArkUI_CrossLanguageOption,15,未确认,P2,ArkUI,,,原句仅说明该结构体用于定义跨语言配置项，未说明开发者在什么场景下需要使用该配置项。结合相关接口中“设置目标节点跨语言设置属性的配置项”和“设置配置项中是否允许跨语言修改属性”的描述，该配置项的使用场景是配置目标节点是否允许跨语言修改属性，当前概述缺少这一场景信息。,,定义跨语言配置项，适用于需要配置目标节点是否允许跨语言修改属性的场景。,定义跨语言配置项。,https://gitcode.com/openharmony_docs_ai/docs_review_platform/blob/main/docs_prompt/12_1_1_2.md,体验,知识点完整,API接口/方法/参数/错误码/权限等完整,验证文档中关于方法/函数的含义/功能、使用场景、使用效果提供完整,是,修改前文档 zh-cn/application-dev/reference/apis-arkui/capi-arkui-nativemodule-arkui-crosslanguageoption.md 第15行仅写“定义跨语言配置项。”，未说明使用场景；interface/sdk_c/zh-cn/arkui/ace_engine/native/native_node.h 第12872行说明该配置项用于目标节点，native_type.h 第5540行说明可配置属性设置能力，第9702行说明可配置节点树操作状态。,已将文档第15行改为“定义跨语言配置项，用于配置目标节点的跨语言访问能力，例如是否允许跨语言修改属性；从API version 26.0.0开始，还可配置节点树跨语言操作状态。”。
cmramc1i60qdlh67bkem22sre,11.2.1.1,检查是否提供开发者在完成某个场景/任务时，需要了解的模块设计逻辑、方法/函数实现机制（应就近提供，API参考中可提供相关链接）。,capi-arkui-nativemodule-arkui-crosslanguageoption.md,https://gitcode.com/openharmony/docs/blob/master/zh-cn/application-dev/reference/apis-arkui/capi-arkui-nativemodule-arkui-crosslanguageoption.md,,ArkUI_CrossLanguageOption,15,未确认,P2,ArkUI,,,该句仅说明结构体是跨语言配置项，未就近说明该配置项的用途或设计逻辑。根据文档后续相关接口描述，该配置项用于设置或获取目标节点是否允许跨语言修改属性，概述处缺少这一关键信息会导致开发者难以理解该结构体在场景中的作用。,,定义跨语言配置项，用于配置目标节点是否允许跨语言修改属性。,定义跨语言配置项。,https://gitcode.com/openharmony_docs_ai/docs_review_platform/blob/main/docs_prompt/11_2_1_1.md,体验,知识点完整,概念/功能/原理/场景描述完整,验证开发者在完成场景/任务时需要的概念、原理、模块整体设计逻辑提供完整,是,修改前文档 zh-cn/application-dev/reference/apis-arkui/capi-arkui-nativemodule-arkui-crosslanguageoption.md 第15行只给出名词定义，未说明配置项在接口设计中的作用；interface native_node.h 第12872行、第12884行分别定义对目标节点设置和获取该配置项，native_type.h 第5540行、第9702行定义该配置项承载属性修改能力和节点树操作状态。,已修改文档第15行，补充该结构体用于配置目标节点跨语言访问能力，并说明可配置属性修改能力和API version 26.0.0起支持的节点树跨语言操作状态。
cmramc1ie0qdmh67b49kmbu4e,11.1.1.1,检查文档中提供的功能场景、特点描述是否全面，能解决哪些问题以及带来的收益是否完整。,capi-arkui-nativemodule-arkui-crosslanguageoption.md,https://gitcode.com/openharmony/docs/blob/master/zh-cn/application-dev/reference/apis-arkui/capi-arkui-nativemodule-arkui-crosslanguageoption.md,,ArkUI_CrossLanguageOption,15,未确认,P2,ArkUI,,,该概述仅重复说明结构体是“跨语言配置项”，未说明该配置项的具体功能、适用场景、能解决的问题或带来的收益，不符合规则对模块/类级别总体描述完整性的要求。,,定义跨语言配置项，用于为目标节点配置跨语言属性修改能力，适用于需要控制不同语言间是否允许修改节点属性的场景。,定义跨语言配置项。,https://gitcode.com/openharmony_docs_ai/docs_review_platform/blob/main/docs_prompt/11_1_1_1.md,体验,知识点完整,概念/功能/原理/场景描述完整,验证模块的定义、功能、使用场景、用法用途完整无缺失,是,修改前文档 zh-cn/application-dev/reference/apis-arkui/capi-arkui-nativemodule-arkui-crosslanguageoption.md 第15行缺少功能范围和收益说明；同页第30行、第31行对应属性修改开关，capi-native-type-h.md 第174行、第175行对应API version 26.0.0新增的节点树操作状态接口。,已在文档第15行补充“用于配置目标节点的跨语言访问能力”，并明确属性修改和节点树跨语言操作两个功能场景。
cmramc1hn0qdjh67bl3df37yl,12.1.2.7,若相关方法/函数间存在配合/制约关系，检查文档中是否有相关描述，描述说明是否完整。,capi-arkui-nativemodule-arkui-crosslanguageoption.md,https://gitcode.com/openharmony/docs/blob/master/zh-cn/application-dev/reference/apis-arkui/capi-arkui-nativemodule-arkui-crosslanguageoption.md,,ArkUI_CrossLanguageOption,28,未确认,P1,ArkUI,,,该接口与 OH_ArkUI_CrossLanguageOption_Destroy 构成 create/destroy 生命周期配对关系。当前描述仅说明创建实例，虽然下一行列出了销毁接口，但未在创建接口说明中明确创建后需要按“先创建、使用完毕后销毁”的顺序配合调用，也未说明不销毁的影响，方法间关系说明不完整。,,| [OH_ArkUI_CrossLanguageOption_Create](capi-native-type-h.md#oh_arkui_crosslanguageoption_create) | 创建跨语言配置项实例。调用该接口创建实例后，使用完毕必须调用[OH_ArkUI_CrossLanguageOption_Destroy](capi-native-type-h.md#oh_arkui_crosslanguageoption_destroy)销毁实例并释放资源；未及时销毁可能导致资源未释放。 |,| [OH_ArkUI_CrossLanguageOption_Create](capi-native-type-h.md#oh_arkui_crosslanguageoption_create) | 创建跨语言配置项实例。 |,https://gitcode.com/BeicC/docs-prompt/blob/master/wait-for-confirm/method_relationship_check.md,体验,知识点完整,API接口/方法/参数/错误码/权限等完整,验证文档中关于方法/函数的使用建议、注意事项提供完整,是,修改前文档 zh-cn/application-dev/reference/apis-arkui/capi-arkui-nativemodule-arkui-crosslanguageoption.md 第28行仅说明创建实例；同页第29行和 interface/sdk_c/zh-cn/arkui/ace_engine/native/native_type.h 第5531行至第5537行定义了对应的 Destroy 接口，Create/Destroy 存在生命周期配合关系。,已将文档第28行改为创建后“使用完毕后，需调用OH_ArkUI_CrossLanguageOption_Destroy销毁实例”，并保留第29行 Destroy 接口说明。
cmramc1hc0qdih67b9yq3cfwu,18.1.1.1,验证文档符合风格指南中对清晰、简洁、具体、一致等维度的规范要求。,capi-arkui-nativemodule-arkui-crosslanguageoption.md,https://gitcode.com/openharmony/docs/blob/master/zh-cn/application-dev/reference/apis-arkui/capi-arkui-nativemodule-arkui-crosslanguageoption.md,,ArkUI_CrossLanguageOption,25,未确认,P1,ArkUI,,,该表格分隔行的第二列仅包含两个连字符，不符合 Markdown 表格分隔行通常至少使用三个连字符的结构要求；在 API 参考文档中会造成表格结构不规范，可能影响“相关接口”表格的稳定渲染。,,|---------------------------------------------------------------------------------| ---- |,|---------------------------------------------------------------------------------| -- |,https://gitcode.com/openharmony_docs_ai/docs_review_platform/blob/main/docs_prompt/18_1_1_1.md,体验,内容规范性,文档语言符合规范,验证文档符合风格指南中对清晰、简洁、具体、一致等维度的规范要求,否,文档 zh-cn/application-dev/reference/apis-arkui/capi-arkui-nativemodule-arkui-crosslanguageoption.md 第25行第二列表格分隔符为“--”；当前仓同类结构体页如 capi-arkui-nativemodule-arkui-activechildreninfo.md 第25行、capi-arkui-nativemodule-arkui-customproperty.md 第25行也使用“--”，该写法可被当前文档体系识别为表格分隔行。,无需修改文档第25行，保持当前仓同类 C API 结构体文档一致的表格分隔符写法。
cmramc1h20qdhh67bztk9c7rx,0.30.1.4,检测 Markdown 文件中代码注释和描述准确性问题、代码规范性检查。,capi-arkui-nativemodule-arkui-crosslanguageoption.md,https://gitcode.com/openharmony/docs/blob/master/zh-cn/application-dev/reference/apis-arkui/capi-arkui-nativemodule-arkui-crosslanguageoption.md,,ArkUI_CrossLanguageOption,10,未确认,P1,ArkUI,,,该行位于 ```c 代码块中，内容是 C 语言 typedef 声明，末尾缺少必需的分号，导致该声明不符合 C 语言语法。,,typedef struct ArkUI_CrossLanguageOption ArkUI_CrossLanguageOption;,typedef struct ArkUI_CrossLanguageOption ArkUI_CrossLanguageOption,https://gitcode.com/BeicC/docs-prompt/blob/feature_use_local_pr_information/agentic-workflow/skills/code-comments/SKILL.md,,,,,否,文档 zh-cn/application-dev/reference/apis-arkui/capi-arkui-nativemodule-arkui-crosslanguageoption.md 第10行位于结构体引用页模板代码块中；同类模板页如 capi-arkui-nativemodule-arkui-activechildreninfo.md 第10行、capi-arkui-nativemodule-arkui-customproperty.md 第10行也采用无分号的 typedef 展示格式，符合当前文档模板。,无需修改文档第10行，保持“typedef struct ArkUI_CrossLanguageOption ArkUI_CrossLanguageOption”模板写法。
