ID,规则编号,规则名称,文档名称,文档地址,API名称,所属父类,问题位置（行号）,问题状态,严重程度,Kit名称,开发责任人,测试责任人,问题描述,备注,修改建议,问题原文,规则提示词,质量维度,一级指标,二级指标,评估内容（测试点）,是否是问题,原因,修改方案
cmramc1co0qczh67bympp687t,12.1.1.2,检查文档中清楚地说明了使用场景。,capi-arkui-nativemodule-arkui-context.md,https://gitcode.com/openharmony/docs/blob/master/zh-cn/application-dev/reference/apis-arkui/capi-arkui-nativemodule-arkui-context.md,,ArkUI_Context,15,未确认,P2,ArkUI,,,该句仅说明 ArkUI_Context 是 native UI 的上下文实例对象，只描述了对象含义，未说明该上下文实例对象适用于哪些 Native UI 开发场景。ArkUI_Context 属于上下文控制/承载类 API 类型，开发者仅凭“上下文实例对象”难以判断何时需要使用，不符合规则对使用场景说明的要求。,,native UI的上下文实例对象，用于Native UI开发中需要传递或使用上下文实例的场景。,native UI的上下文实例对象。,https://gitcode.com/openharmony_docs_ai/docs_review_platform/blob/main/docs_prompt/12_1_1_2.md,体验,知识点完整,API接口/方法/参数/错误码/权限等完整,验证文档中关于方法/函数的含义/功能、使用场景、使用效果提供完整,是,文档 zh-cn/application-dev/reference/apis-arkui/capi-arkui-nativemodule-arkui-context.md 第15行修改前仅说明“native UI的上下文实例对象”，未说明使用场景；interface/sdk_c/arkui/ace_engine/native/native_node.h 第13918行说明该上下文是节点所在页面的 UIContext，第14448行说明 context 是 UI 任务所在页面的 UIContext 入参。,已修改文档 zh-cn/application-dev/reference/apis-arkui/capi-arkui-nativemodule-arkui-context.md 第15行，补充其表示组件所在页面的 UIContext、可通过 OH_ArkUI_GetContextByNode 获取，并可作为拖拽操作、动画、UI 任务调度等接口的上下文入参。
cmramc1cx0qd0h67bj2e25nsx,11.2.1.1,检查是否提供开发者在完成某个场景/任务时，需要了解的模块设计逻辑、方法/函数实现机制（应就近提供，API参考中可提供相关链接）。,capi-arkui-nativemodule-arkui-context.md,https://gitcode.com/openharmony/docs/blob/master/zh-cn/application-dev/reference/apis-arkui/capi-arkui-nativemodule-arkui-context.md,,ArkUI_Context,15,未确认,P2,ArkUI,,,该概述仅说明ArkUI_Context是native UI的上下文实例对象，未就近说明该上下文对象在相关模块中的设计用途、承载的信息或开发者使用相关API时需要理解的作用机制；作为API参考中的概念说明，信息过于简略，不满足规则对模块设计逻辑/实现机制相关必要信息的要求。,,native UI的上下文实例对象，用于承载ArkUI NativeModule相关操作所需的上下文信息。,native UI的上下文实例对象。,https://gitcode.com/openharmony_docs_ai/docs_review_platform/blob/main/docs_prompt/11_2_1_1.md,体验,知识点完整,概念/功能/原理/场景描述完整,验证开发者在完成场景/任务时需要的概念、原理、模块整体设计逻辑提供完整,是,文档 zh-cn/application-dev/reference/apis-arkui/capi-arkui-nativemodule-arkui-context.md 第15行修改前缺少该上下文对象的承载信息和使用机制；interface/sdk_c/arkui/ace_engine/native/native_type.h 第155行定义不透明 ArkUI_Context 结构，第162行定义 ArkUI_ContextHandle 指针，interface/sdk_c/arkui/ace_engine/native/native_node.h 第13925行提供获取该上下文指针的接口。,已修改文档 zh-cn/application-dev/reference/apis-arkui/capi-arkui-nativemodule-arkui-context.md 第15行，补充 ArkUI_ContextHandle 指针类型说明和通过 OH_ArkUI_GetContextByNode 获取上下文的机制说明。
cmramc1d50qd1h67b7j5l5j10,11.1.1.1,检查文档中提供的功能场景、特点描述是否全面，能解决哪些问题以及带来的收益是否完整。,capi-arkui-nativemodule-arkui-context.md,https://gitcode.com/openharmony/docs/blob/master/zh-cn/application-dev/reference/apis-arkui/capi-arkui-nativemodule-arkui-context.md,,ArkUI_Context,15,未确认,P2,ArkUI,,,该概述属于类/结构体级别的总体描述，当前仅说明ArkUI_Context是上下文实例对象，未说明其在ArkUI Native模块中的用途、适用场景或能帮助开发者解决的问题，功能场景描述不够完整。,,native UI的上下文实例对象，用于提供ArkUI Native模块中的上下文信息，适用于native侧访问或管理UI上下文的场景。,native UI的上下文实例对象。,https://gitcode.com/openharmony_docs_ai/docs_review_platform/blob/main/docs_prompt/11_1_1_1.md,体验,知识点完整,概念/功能/原理/场景描述完整,验证模块的定义、功能、使用场景、用法用途完整无缺失,是,文档 zh-cn/application-dev/reference/apis-arkui/capi-arkui-nativemodule-arkui-context.md 第15行修改前只描述对象含义，未说明用途；interface/sdk_c/arkui/ace_engine/native/drag_and_drop.h 第571行、native_animate.h 第178行、native_node.h 第14456行均将 ArkUI_ContextHandle 作为拖拽、动画或 UI 任务接口的上下文入参。,已修改文档 zh-cn/application-dev/reference/apis-arkui/capi-arkui-nativemodule-arkui-context.md 第15行，补充该对象可用于拖拽操作、动画、UI 任务调度等接口的上下文入参。
cmramc1ce0qcyh67bw2smqxpp,18.1.1.1,验证文档符合风格指南中对清晰、简洁、具体、一致等维度的规范要求。,capi-arkui-nativemodule-arkui-context.md,https://gitcode.com/openharmony/docs/blob/master/zh-cn/application-dev/reference/apis-arkui/capi-arkui-nativemodule-arkui-context.md,,ArkUI_Context,15,未确认,P3,ArkUI,,,该句为中英文混排，“UI”和中文助词“的”之间缺少空格，不符合中英文之间应保留空格的格式一致性要求。原句确实存在于文档第15行，且不属于代码块、链接、路径、命令或固定术语本身的问题。,,native UI 的上下文实例对象。,native UI的上下文实例对象。,https://gitcode.com/openharmony_docs_ai/docs_review_platform/blob/main/docs_prompt/18_1_1_1.md,体验,内容规范性,文档语言符合规范,验证文档符合风格指南中对清晰、简洁、具体、一致等维度的规范要求,是,文档 zh-cn/application-dev/reference/apis-arkui/capi-arkui-nativemodule-arkui-context.md 第15行修改前为“native UI的上下文实例对象。”，英文 UI 与中文助词“的”之间缺少空格，且概述语句不够清晰。,已修改文档 zh-cn/application-dev/reference/apis-arkui/capi-arkui-nativemodule-arkui-context.md 第15行，将表述调整为“ArkUI native UI 的上下文实例对象...”并补充完整说明。
cmramc1c60qcxh67bvecus2xp,0.30.1.4,检测 Markdown 文件中代码注释和描述准确性问题、代码规范性检查。,capi-arkui-nativemodule-arkui-context.md,https://gitcode.com/openharmony/docs/blob/master/zh-cn/application-dev/reference/apis-arkui/capi-arkui-nativemodule-arkui-context.md,,ArkUI_Context,10,未确认,P1,ArkUI,,,该行位于第 9-11 行的 c 代码块中，是 C 语言 typedef 声明；当前声明末尾缺少分号，不符合 C 语法。补充分号后才是合法的结构体不透明类型别名声明。,,typedef struct ArkUI_Context ArkUI_Context;,typedef struct ArkUI_Context ArkUI_Context,https://gitcode.com/BeicC/docs-prompt/blob/feature_use_local_pr_information/agentic-workflow/skills/code-comments/SKILL.md,,,,,否,文档 zh-cn/application-dev/reference/apis-arkui/capi-arkui-nativemodule-arkui-context.md 第10行采用 C API 参考文档模板中的类型声明展示格式；同类文档 zh-cn/application-dev/reference/apis-arkui/capi-arkui-nativemodule-arkui-drawcontext.md 第10行同样写作 typedef struct ArkUI_DrawContext ArkUI_DrawContext，未在代码块中补分号，因此该扫描项为模板格式误报。,已将文档 zh-cn/application-dev/reference/apis-arkui/capi-arkui-nativemodule-arkui-context.md 第10行恢复为 typedef struct ArkUI_Context ArkUI_Context；该项无需按 interface/sdk_c/arkui/ace_engine/native/drag_and_drop.h 第177行补充分号。
